Api,Description,Category
oyyi,"API for Fake Data, image/video conversion, optimization, pdf optimization and thumbnail generation",Development
PageCDN,"Public API for javascript, css and font libraries on PageCDN",Development
Postman,Tool for testing APIs,Development
ProxyCrawl,Scraping and crawling anticaptcha service,Development
ProxyKingdom,Rotating Proxy API that produces a working proxy on every request,Development
Pusher Beams,Push notifications for Android & iOS,Development
QR code,Create an easy to read QR code and URL shortener,Development
QR code,Generate and decode / read QR code graphics,Development
Qrcode Monkey,Integrate custom and unique looking QR codes into your system or workflow,Development
QuickChart,Generate chart and graph images,Development
Random Stuff,"Can be used to get AI Response, jokes, memes, and much more at lightning-fast speed",Development
Rejax,Reverse AJAX service to notify clients,Development
ReqRes,A hosted REST-API ready to respond to your AJAX requests,Development
RSS feed to JSON,Returns RSS feed in JSON format using feed URL,Development
SavePage.io,"A free, RESTful API used to screenshot any desktop, or mobile website",Development
ScrapeNinja,Scraping API with Chrome fingerprint and residential proxies,Development
ScraperApi,Easily build scalable web scrapers,Development
scraperBox,Undetectable web scraping API,Development
scrapestack,"Real-time, Scalable Proxy & Web Scraping REST API",Development
ScrapingAnt,Headless Chrome scraping with a simple API,Development
ScrapingDog,Proxy API for Web scraping,Development
ScreenshotAPI.net,Create pixel-perfect website screenshots,Development
Serialif Color,"Color conversion, complementary, grayscale and contrasted text",Development
serpstack,Real-Time & Accurate Google Search Results API,Development
Sheetsu,Easy google sheets integration,Development
SHOUTCLOUD,ALL-CAPS AS A SERVICE,Development
Sonar,Project Sonar DNS Enumeration API,Development
SonarQube,"SonarQube REST APIs to detect bugs, code smells & security vulnerabilities",Development
StackExchange,Q&A forum for developers,Development
Statically,A free CDN for developers,Development
Supportivekoala,Autogenerate images with template,Development
Tyk,Api and service management platform,Development
Wandbox,Code compiler supporting 35+ languages mentioned at wandbox.org,Development
WebScraping.AI,Web Scraping API with built-in proxies and JS rendering,Development
ZenRows,"Web Scraping API that bypasses anti-bot solutions while offering JS rendering, and rotating proxies",Development
Chinese Character Web,Chinese character definitions and pronunciations,Dictionaries
Chinese Text Project,Online open-access digital library for pre-modern Chinese texts,Dictionaries
Collins,Bilingual Dictionary and Thesaurus Data,Dictionaries
Free Dictionary,"Definitions, phonetics, pronounciations, parts of speech, examples, synonyms",Dictionaries
Indonesia Dictionary,Indonesia dictionary many words,Dictionaries
Lingua Robot,"Word definitions, pronunciations, synonyms, antonyms and others",Dictionaries
Merriam-Webster,Dictionary and Thesaurus Data,Dictionaries
OwlBot,Definitions with example sentence and photo if available,Dictionaries
Oxford,Dictionary Data,Dictionaries
Synonyms,"Synonyms, thesaurus and antonyms information for any given word",Dictionaries
Wiktionary,Collaborative dictionary data,Dictionaries
Wordnik,Dictionary Data,Dictionaries
Words,"Definitions and synonyms for more than 150,000 words",Dictionaries
Airtable,Integrate with Airtable,Documents & Productivity
Api2Convert,Online File Conversion API,Documents & Productivity
apilayer pdflayer,HTML/URL to PDF,Documents & Productivity
Asana,Programmatic access to all data in your asana system,Documents & Productivity
ClickUp,"ClickUp is a robust, cloud-based project management tool for boosting productivity",Documents & Productivity
Clockify,Clockify's REST-based API can be used to push/pull data to/from it & integrate it with other systems,Documents & Productivity
CloudConvert,"Online file converter for audio, video, document, ebook, archive, image, spreadsheet, presentation",Documents & Productivity
Cloudmersive Document and Data Conversion,"HTML/URL to PDF/PNG, Office documents to PDF, image conversion",Documents & Productivity
Code::Stats,Automatic time tracking for programmers,Documents & Productivity
CraftMyPDF,Generate PDF documents from templates with a drop-and-drop editor and a simple API,Documents & Productivity
Flowdash,Automate business workflows,Documents & Productivity
Html2PDF,HTML/URL to PDF,Documents & Productivity
iLovePDF,"Convert, merge, split, extract text and add page numbers for PDFs. Free for 250 documents/month",Documents & Productivity
JIRA,JIRA is a proprietary issue tracking product that allows bug tracking and agile project management,Documents & Productivity
Mattermost,An open source platform for developer collaboration,Documents & Productivity
Mercury,Web parser,Documents & Productivity
Monday,Programmatically access and update data inside a monday.com account,Documents & Productivity
Notion,Integrate with Notion,Documents & Productivity
PandaDoc,DocGen and eSignatures API,Documents & Productivity
Pocket,Bookmarking service,Documents & Productivity
Podio,File sharing and productivity,Documents & Productivity
PrexView,"Data from XML or JSON to PDF, HTML or Image",Documents & Productivity
Restpack,"Provides screenshot, HTML to PDF and content extraction APIs",Documents & Productivity
Todoist,Todo Lists,Documents & Productivity
Smart Image Enhancement API,Performs image upscaling by adding detail to images through multiple super-resolution algorithms,Documents & Productivity
Vector Express v2.0,Free vector file converting API,Documents & Productivity
WakaTime,Automated time tracking leaderboards for programmers,Documents & Productivity
Zube,Full stack project management,Documents & Productivity
Abstract Email Validation,Validate email addresses for deliverability and spam,Email
apilayer mailboxlayer,Email address validation,Email
Cloudmersive Validate,"Validate email addresses, phone numbers, VAT numbers and domain names",Email
Disify,Validate and detect disposable and temporary email addresses,Email
DropMail,GraphQL API for creating and managing ephemeral e-mail inboxes,Email
EVA,Validate email addresses,Email
Guerrilla Mail,Disposable temporary Email addresses,Email
ImprovMX,API for free email forwarding service,Email
Kickbox,Email verification API,Email
mail.gw,10 Minute Mail,Email
mail.tm,Temporary Email Service,Email
MailboxValidator,Validate email address to improve deliverability,Email
MailCheck.ai,Prevent users to sign up with temporary email addresses,Email
Mailtrap,A service for the safe testing of emails sent from the development and staging environments,Email
Sendgrid,A cloud-based SMTP provider that allows you to send emails without having to maintain email servers,Email
Sendinblue,A service that provides solutions relating to marketing and/or transactional email and/or SMS,Email
Verifier,Verifies that a given email is real,Email
chucknorris.io,JSON API for hand curated Chuck Norris jokes,Entertainment
Corporate Buzz Words,REST API for Corporate Buzz Words,Entertainment
Excuser,Get random excuses for various situations,Entertainment
Fun Fact,A simple HTTPS api that can randomly select and return a fact from the FFA database,Entertainment
Imgflip,Gets an array of popular memes,Entertainment
Meme Maker,REST API for create your own meme,Entertainment
NaMoMemes,Memes on Narendra Modi,Entertainment
Random Useless Facts,"Get useless, but true facts",Entertainment
Techy,JSON and Plaintext API for tech-savvy sounding phrases,Entertainment
Yo Momma Jokes,REST API for Yo Momma Jokes,Entertainment
BreezoMeter Pollen,Daily Forecast pollen conditions data for a specific location,Environment
Carbon Interface,API to calculate carbon (C02) emissions estimates for common C02 emitting activities,Environment
Climatiq,Calculate the environmental footprint created by a broad range of emission-generating activities,Environment
Cloverly,API calculates the impact of common carbon-intensive activities in real time,Environment
CO2 Offset,API calculates and validates the carbon footprint,Environment
Danish data service Energi,Open energy data from Energinet to society,Environment
GrünstromIndex,Green Power Index for Germany (Grünstromindex/GSI),Environment
IQAir,Air quality and weather data,Environment
Luchtmeetnet,Predicted and actual air quality components for The Netherlands (RIVM),Environment
National Grid ESO,Open data from Great Britain’s Electricity System Operator,Environment
OpenAQ,Open air quality data,Environment
PM2.5 Open Data Portal,Open low-cost PM2.5 sensor data,Environment
PM25.in,Air quality of China,Environment
PVWatts,Energy production photovoltaic (PV) energy systems,Environment
Srp Energy,Hourly usage energy report for Srp customers,Environment
UK Carbon Intensity,The Official Carbon Intensity API for Great Britain developed by National Grid,Environment
Website Carbon,API to estimate the carbon footprint of loading web pages,Environment
Eventbrite,Find events,Events
SeatGeek,"Search events, venues and performers",Events
Ticketmaster,"Search events, attractions, or venues",Events
Abstract VAT Validation,Validate VAT numbers and calculate VAT rates,Finance
Aletheia,"Insider trading data, earnings call analysis, financial statements, and more",Finance
Alpaca,Realtime and historical market data on all US equities and ETFs,Finance
Alpha Vantage,Realtime and historical stock data,Finance
apilayer marketstack,"Real-Time, Intraday & Historical Market Data API",Finance
Banco do Brasil,All Banco do Brasil financial transaction APIs,Finance
Bank Data API,Instant IBAN and SWIFT number validation across the globe,Finance
Billplz,Payment platform,Finance
Binlist,Public access to a database of IIN/BIN information,Finance
Boleto.Cloud,A api to generate boletos in Brazil,Finance
Citi,All Citigroup account and statement data APIs,Finance
Econdb,Global macroeconomic data,Finance
Fed Treasury,U.S. Department of the Treasury Data,Finance
Finage,"Finage is a stock, currency, cryptocurrency, indices, and ETFs real-time & historical data provider",Finance
Financial Modeling Prep,Realtime and historical stock data,Finance
Finnhub,"Real-Time RESTful APIs and Websocket for Stocks, Currencies, and Crypto",Finance
FRED,Economic data from the Federal Reserve Bank of St. Louis,Finance
Front Accounting APIs,Front accounting is multilingual and multicurrency software for small businesses,Finance
Hotstoks,Stock market data powered by SQL,Finance
IEX Cloud,Realtime & Historical Stock and Market Data,Finance
IG,Spreadbetting and CFD Market Data,Finance
Indian Mutual Fund,Get complete history of India Mutual Funds Data,Finance
Intrinio,A wide selection of financial data feeds,Finance
Klarna,Klarna payment and shopping service,Finance
MercadoPago,Mercado Pago API reference - all the information you need to develop your integrations,Finance
Mono,Connect with users’ bank accounts and access transaction data in Africa,Finance
Moov,"The Moov API makes it simple for platforms to send, receive, and store money",Finance
Nordigen,Connect to bank accounts using official bank APIs and get raw transaction data,Finance
OpenFIGI,"Equity, index, futures, options symbology from Bloomberg LP",Finance
Plaid,Connect with user's bank accounts and access transaction data,Finance
Polygon,Historical stock market data,Finance
Portfolio Optimizer,Portfolio analysis and optimization,Finance
Razorpay IFSC,Indian Financial Systems Code (Bank Branch Codes),Finance
Real Time Finance,Websocket API to access realtime stock data,Finance
SEC EDGAR Data,API to access annual reports of public US companies,Finance
SmartAPI,Gain access to set of <SmartAPI> and create end-to-end broking services,Finance
StockData,"Real-Time, Intraday & Historical Market Data, News and Sentiment API",Finance
Styvio,Realtime and historical stock data and current stock sentiment,Finance
Tax Data API,Instant VAT number and tax validation across the globe,Finance
Tradier,"US equity/option market data (delayed, intraday, historical)",Finance
Twelve Data,Stock market data (real-time & historical),Finance
WallstreetBets,WallstreetBets Stock Comments Sentiment Analysis,Finance
Yahoo Finance,"Real time low latency Yahoo Finance API for stock market, crypto currencies, and currency exchange",Finance
YNAB,Budgeting & Planning,Finance
Zoho Books,"Online accounting software, built for your business",Finance
BaconMockup,Resizable bacon placeholder images,Food & Drink
Chomp,Data about various grocery products and foods,Food & Drink
Coffee,Random pictures of coffee,Food & Drink
Edamam nutrition,Nutrition Analysis,Food & Drink
Edamam recipes,Recipe Search,Food & Drink
Foodish,Random pictures of food dishes,Food & Drink
Fruityvice,Data about all kinds of fruit,Food & Drink
Kroger,Supermarket Data,Food & Drink
LCBO,Alcohol,Food & Drink
Open Brewery DB,"Breweries, Cideries and Craft Beer Bottle Shops",Food & Drink
Open Food Facts,Food Products Database,Food & Drink
PunkAPI,Brewdog Beer Recipes,Food & Drink
Rustybeer,Beer brewing tools,Food & Drink
Spoonacular,"Recipes, Food Products, and Meal Planning",Food & Drink
Systembolaget,Govornment owned liqour store in Sweden,Food & Drink
TacoFancy,Community-driven taco database,Food & Drink
Tasty,"API to query data about recipe, plan, ingredients",Food & Drink
The Report of the Week,Food & Drink Reviews,Food & Drink
TheCocktailDB,Cocktail Recipes,Food & Drink
TheMealDB,Meal Recipes,Food & Drink
Untappd,Social beer sharing,Food & Drink
What's on the menu?,NYPL human-transcribed historical menu collection,Food & Drink
WhiskyHunter,Past online whisky auctions statistical data,Food & Drink
Zestful,Parse recipe ingredients,Food & Drink
Age of Empires II,Get information about Age of Empires II resources,Games & Comics
AmiiboAPI,Nintendo Amiibo Information,Games & Comics
Animal Crossing: New Horizons,"API for critters, fossils, art, music, furniture and villagers",Games & Comics
Autochess VNG,Rest Api for Autochess VNG,Games & Comics
Barter.VG,"Provides information about Game, DLC, Bundles, Giveaways, Trading",Games & Comics
Battle.net,"Diablo III, Hearthstone, StarCraft II and World of Warcraft game data APIs",Games & Comics
Board Game Geek,"Board games, RPG and videogames",Games & Comics
Brawl Stars,Brawl Stars Game Information,Games & Comics
Bugsnax,Get information about Bugsnax,Games & Comics
CheapShark,Steam/PC Game Prices and Deals,Games & Comics
Chess.com,Chess.com read-only REST API,Games & Comics
Chuck Norris Database,Jokes,Games & Comics
Clash of Clans,Clash of Clans Game Information,Games & Comics
Clash Royale,Clash Royale Game Information,Games & Comics
Comic Vine,Comics,Games & Comics
Crafatar,API for Minecraft skins and faces,Games & Comics
Cross Universe,Cross Universe Card Data,Games & Comics
Deck of Cards,Deck of Cards,Games & Comics
Destiny The Game,Bungie Platform API,Games & Comics
Digimon Information,Provides information about digimon creatures,Games & Comics
Digimon TCG,Search for Digimon cards in digimoncard.io,Games & Comics
Disney,Information of Disney characters,Games & Comics
Dota 2,"Provides information about Player stats , Match stats, Rankings for Dota 2",Games & Comics
Dungeons and Dragons,"Reference for 5th edition spells, classes, monsters, and more",Games & Comics
Dungeons and Dragons (Alternate),Includes all monsters and spells from the SRD (System Reference Document) as well as a search API,Games & Comics
Eve Online,Third-Party Developer Documentation,Games & Comics
FFXIV Collect,Final Fantasy XIV data on collectables,Games & Comics
FIFA Ultimate Team,FIFA Ultimate Team items API,Games & Comics
Final Fantasy XIV,Final Fantasy XIV Game data API,Games & Comics
Fortnite,Fortnite Stats,Games & Comics
Forza,Show random image of car from Forza,Games & Comics
FreeToGame,Free-To-Play Games Database,Games & Comics
Fun Facts,Random Fun Facts,Games & Comics
FunTranslations,Translate Text into funny languages,Games & Comics
GamerPower,Game Giveaways Tracker,Games & Comics
GDBrowser,Easy way to use the Geometry Dash Servers,Games & Comics
Geek-Jokes,Fetch a random geeky/programming related joke for use in all sorts of applications,Games & Comics
Genshin Impact,Genshin Impact game data,Games & Comics
Giant Bomb,Video Games,Games & Comics
GraphQL Pokemon,GraphQL powered Pokemon API. Supports generations 1 through 8,Games & Comics
Guild Wars 2,Guild Wars 2 Game Information,Games & Comics
GW2Spidy,"GW2Spidy API, Items data on the Guild Wars 2 Trade Market",Games & Comics
Halo,Halo 5 and Halo Wars 2 Information,Games & Comics
Hearthstone,Hearthstone Cards Information,Games & Comics
Humble Bundle,Humble Bundle's current bundles,Games & Comics
Humor,"Humor, Jokes, and Memes",Games & Comics
Hypixel,Hypixel player stats,Games & Comics
Hyrule Compendium,Data on all interactive items from The Legend of Zelda: BOTW,Games & Comics
Hytale,Hytale blog posts and jobs,Games & Comics
IGDB.com,Video Game Database,Games & Comics
JokeAPI,"Programming, Miscellaneous and Dark Jokes",Games & Comics
Jokes One,Joke of the day and large category of jokes accessible via REST API,Games & Comics
Jservice,Jeopardy Question Database,Games & Comics
Lichess,"Access to all data of users, games, puzzles and etc on Lichess",Games & Comics
Magic The Gathering,Magic The Gathering Game Information,Games & Comics
Mario Kart Tour,"API for Drivers, Karts, Gliders and Courses",Games & Comics
Marvel,Marvel Comics,Games & Comics
Minecraft Server Status,API to get Information about a Minecraft Server,Games & Comics
MMO Games,"MMO Games Database, News and Giveaways",Games & Comics
mod.io,Cross Platform Mod API,Games & Comics
Mojang,Mojang / Minecraft API,Games & Comics
Monster Hunter World,Monster Hunter World data,Games & Comics
Open Trivia,Trivia Questions,Games & Comics
PandaScore,E-sports games and results,Games & Comics
Path of Exile,Path of Exile Game Information,Games & Comics
PlayerDB,"Query Minecraft, Steam and XBox Accounts",Games & Comics
Pokéapi,Pokémon Information,Games & Comics
PokéAPI (GraphQL),The Unofficial GraphQL for PokeAPI,Games & Comics
Pokémon TCG,Pokémon TCG Information,Games & Comics
Psychonauts,Psychonauts World Characters Information and PSI Powers,Games & Comics
PUBG,Access in-game PUBG data,Games & Comics
Puyo Nexus,Puyo Puyo information from Puyo Nexus Wiki,Games & Comics
quizapi.io,Access to various kind of quiz questions,Games & Comics
Raider,Provides detailed character and guild rankings for Raiding and Mythic+ content in World of Warcraft,Games & Comics
RAWG.io,"500,000+ games for 50 platforms including mobiles",Games & Comics
Rick and Morty,"All the Rick and Morty information, including images",Games & Comics
Riot Games,League of Legends Game Information,Games & Comics
RPS 101,"Rock, Paper, Scissors with 101 objects",Games & Comics
RuneScape,RuneScape and OSRS RPGs information,Games & Comics
Sakura CardCaptor,Sakura CardCaptor Cards Information,Games & Comics
Scryfall,Magic: The Gathering database,Games & Comics
SpaceTradersAPI,A playable inter-galactic space trading MMOAPI,Games & Comics
Steam,Steam Web API documentation,Games & Comics
Steam,Internal Steam Web API documentation,Games & Comics
SuperHeroes,All SuperHeroes and Villains data from all universes under a single API,Games & Comics
TCGdex,Multi languages Pokémon TCG Information,Games & Comics
Tebex,Tebex API for information about game purchases,Games & Comics
TETR.IO,TETR.IO Tetra Channel API,Games & Comics
Tronald Dump,The dumbest things Donald Trump has ever said,Games & Comics
Universalis,Final Fantasy XIV market board data,Games & Comics
Valorant (non-official),"An extensive API containing data of most Valorant in-game items, assets and more",Games & Comics
Warface (non-official),Official API proxy with better data structure and more features,Games & Comics
Wargaming.net,Wargaming.net info and stats,Games & Comics
When is next MCU film,Upcoming MCU film information,Games & Comics
xkcd,Retrieve xkcd comics as JSON,Games & Comics
Yu-Gi-Oh!,Yu-Gi-Oh! TCG Information,Games & Comics
Abstract IP Geolocation,Geolocate website visitors from their IPs,Geocoding
Actinia Grass GIS,Actinia is an open source REST API for geographical data that uses GRASS GIS,Geocoding
administrative-divisons-db,Get all administrative divisions of a country,Geocoding
adresse.data.gouv.fr,"Address database of France, geocoding and reverse",Geocoding
Airtel IP,IP Geolocation API. Collecting data from multiple sources,Geocoding
Apiip,Get location information by IP address,Geocoding
apilayer ipstack,Locate and identify website visitors by IP address,Geocoding
Battuta,A (country/region/city) in-cascade location API,Geocoding
BigDataCloud,Provides fast and accurate IP geolocation APIs along with security checks and confidence area,Geocoding
Bing Maps,Create/customize digital maps based on Bing Maps data,Geocoding
bng2latlong,Convert British OSGB36 easting and northing (British National Grid) to WGS84 latitude and longitude,Geocoding
Cartes.io,Create maps and markers for anything,Geocoding
Cep.la,"Brazil RESTful API to find information about streets, zip codes, neighborhoods, cities and states",Geocoding
CitySDK,Open APIs for select European cities,Geocoding
Country,Get your visitor's country from their IP,Geocoding
CountryStateCity,"World countries, states, regions, provinces, cities & towns in JSON, SQL, XML, YAML, & CSV format",Geocoding
Ducks Unlimited,API explorer that gives a query URL with a JSON response of locations and cities,Geocoding
FreeGeoIP,"Free geo ip information, no registration required. 15k/hour rate limit",Geocoding
GeoApi,French geographical data,Geocoding
Geoapify,"Forward and reverse geocoding, address autocomplete",Geocoding
Geocod.io,Address geocoding / reverse geocoding in bulk,Geocoding
Geocode.xyz,"Provides worldwide forward/reverse geocoding, batch geocoding and geoparsing",Geocoding
Geocodify.com,"Worldwide geocoding, geoparsing and autocomplete for addresses",Geocoding
Geodata.gov.gr,Open geospatial data and API service for Greece,Geocoding
GeoDataSource,Geocoding of city name by using latitude and longitude coordinates,Geocoding
GeoDB Cities,"Get global city, region, and country data",Geocoding
GeographQL,"A Country, State, and City GraphQL API",Geocoding
GeoJS,IP geolocation with ChatOps integration,Geocoding
Geokeo,Geokeo geocoding service- with 2500 free api requests daily,Geocoding
GeoNames,Place names and other geographical data,Geocoding
geoPlugin,IP geolocation and currency conversion,Geocoding
Google Earth Engine,A cloud-based platform for planetary-scale environmental data analysis,Geocoding
Google Maps,Create/customize digital maps based on Google Maps data,Geocoding
Graph Countries,"Country-related data like currencies, languages, flags, regions+subregions and bordering countries",Geocoding
HelloSalut,Get hello translation following user language,Geocoding
HERE Maps,Create/customize digital maps based on HERE Maps data,Geocoding
Hirak IP to Country,"Ip to location with country code, currency code & currency name, fast response, unlimited requests",Geocoding
Hong Kong GeoData Store,API for accessing geo-data of Hong Kong,Geocoding
IBGE,Aggregate services of IBGE (Brazilian Institute of Geography and Statistics),Geocoding
IP 2 Country,Map an IP to a country,Geocoding
IP Address Details,Find geolocation with ip address,Geocoding
IP Vigilante,Free IP Geolocation API,Geocoding
ip-api,Find location with IP address or domain,Geocoding
IP2Location,IP geolocation web service to get more than 55 parameters,Geocoding
IP2Proxy,Detect proxy and VPN using IP address,Geocoding
ipapi.co,Find IP address location information,Geocoding
ipapi.com,Real-time Geolocation & Reverse IP Lookup REST API,Geocoding
IPGEO,Unlimited free IP Address API with useful information,Geocoding
ipgeolocation,IP Geolocation AP with free plan 30k requests per month,Geocoding
IPInfoDB,"Free Geolocation tools and APIs for country, region, city and time zone lookup by IP address",Geocoding
Kakao Maps,Kakao Maps provide multiple APIs for Korean maps,Geocoding
keycdn IP Location Finder,Get the IP geolocation data through the simple REST API. All the responses are JSON encoded,Geocoding
LocationIQ,Provides forward/reverse geocoding and batch geocoding,Geocoding
Longdo Map,Interactive map with detailed places and information portal in Thailand,Geocoding
Mapbox,Create/customize beautiful digital maps,Geocoding
MapQuest,To access tools and resources to map the world,Geocoding
Mexico,Mexico RESTful zip codes API,Geocoding
Nominatim,Provides worldwide forward / reverse geocoding,Geocoding
"One Map, Singapore",Singapore Land Authority REST API services for Singapore addresses,Geocoding
OnWater,Determine if a lat/lon is on water or land,Geocoding
Open Topo Data,Elevation and ocean depth for a latitude and longitude,Geocoding
OpenCage,Forward and reverse geocoding using open data,Geocoding
openrouteservice.org,"Directions, POIs, isochrones, geocoding (+reverse), elevation, and more",Geocoding
OpenStreetMap,"Navigation, geolocation and geographical data",Geocoding
Pinball Map,A crowdsourced map of public pinball machines,Geocoding
positionstack,Forward & Reverse Batch Geocoding REST API,Geocoding
Postali,Mexico Zip Codes API,Geocoding
PostcodeData.nl,Provide geolocation data based on postcode for Dutch addresses,Geocoding
Postcodes.io,Postcode lookup & Geolocation for the UK,Geocoding
Queimadas INPE,Access to heat focus data (probable wildfire),Geocoding
